{
  "schemaVersion": 1,
  "status": "fixture",
  "origins": [
    { "id": "origin_working", "familyId": "family_working", "genderId": "gender_a", "zodiacSignId": "aries", "resources": { "wealth": 45, "education": 50, "familySupport": 65, "socialConnections": 45, "healthEnvironment": 55 }, "finance": { "income": 48000, "cash": 5000, "assets": 12000, "debt": 2000, "fixedExpenses": 30000 } },
    { "id": "origin_professional", "familyId": "family_professional", "genderId": "gender_b", "zodiacSignId": "taurus", "resources": { "wealth": 65, "education": 80, "familySupport": 60, "socialConnections": 65, "healthEnvironment": 70 }, "finance": { "income": 90000, "cash": 12000, "assets": 50000, "debt": 10000, "fixedExpenses": 52000 } },
    { "id": "origin_business", "familyId": "family_business", "genderId": "gender_c", "zodiacSignId": "gemini", "resources": { "wealth": 70, "education": 60, "familySupport": 55, "socialConnections": 80, "healthEnvironment": 60 }, "finance": { "income": 100000, "cash": 15000, "assets": 80000, "debt": 30000, "fixedExpenses": 60000 } },
    { "id": "origin_single_parent", "familyId": "family_single_parent", "genderId": "gender_a", "zodiacSignId": "cancer", "resources": { "wealth": 35, "education": 50, "familySupport": 55, "socialConnections": 40, "healthEnvironment": 50 }, "finance": { "income": 36000, "cash": 2500, "assets": 5000, "debt": 5000, "fixedExpenses": 28000 } },
    { "id": "origin_low_income", "familyId": "family_low_income", "genderId": "gender_b", "zodiacSignId": "leo", "resources": { "wealth": 20, "education": 35, "familySupport": 50, "socialConnections": 35, "healthEnvironment": 40 }, "finance": { "income": 22000, "cash": 500, "assets": 1000, "debt": 4000, "fixedExpenses": 20000 } }
  ],
  "families": [
    { "id": "family_working", "type": "working_class", "originId": "origin_working", "parentNpcIds": ["parent_working_a", "parent_working_b"] },
    { "id": "family_professional", "type": "professional", "originId": "origin_professional", "parentNpcIds": ["parent_professional_a", "parent_professional_b"] },
    { "id": "family_business", "type": "business", "originId": "origin_business", "parentNpcIds": ["parent_business_a", "parent_business_b"] },
    { "id": "family_single_parent", "type": "single_parent", "originId": "origin_single_parent", "parentNpcIds": ["parent_single_a"] },
    { "id": "family_low_income", "type": "low_income", "originId": "origin_low_income", "parentNpcIds": ["parent_low_a", "parent_low_b"] }
  ],
  "parentJobs": [
    { "id": "job_service", "sector": "service", "incomeBand": "medium" },
    { "id": "job_technical", "sector": "technical", "incomeBand": "medium" },
    { "id": "job_professional", "sector": "professional", "incomeBand": "high" },
    { "id": "job_business", "sector": "business", "incomeBand": "high" },
    { "id": "job_care", "sector": "care", "incomeBand": "low" },
    { "id": "job_unemployed", "sector": "unemployed", "incomeBand": "none" }
  ],
  "genders": [{ "id": "gender_a" }, { "id": "gender_b" }, { "id": "gender_c" }],
  "zodiacSigns": [
    { "id": "aries" }, { "id": "taurus" }, { "id": "gemini" }, { "id": "cancer" },
    { "id": "leo" }, { "id": "virgo" }, { "id": "libra" }, { "id": "scorpio" },
    { "id": "sagittarius" }, { "id": "capricorn" }, { "id": "aquarius" }, { "id": "pisces" }
  ],
  "ageBands": [
    { "id": "child", "minAge": 0, "maxAge": 12 },
    { "id": "teen", "minAge": 13, "maxAge": 17 },
    { "id": "adult", "minAge": 18, "maxAge": 39 },
    { "id": "middle_age", "minAge": 40, "maxAge": 59 },
    { "id": "older_adult", "minAge": 60, "maxAge": 120 }
  ],
  "events": [
    { "id": "fixture_child_event", "ageBandId": "child" },
    { "id": "fixture_teen_event", "ageBandId": "teen" },
    { "id": "fixture_adult_event", "ageBandId": "adult" },
    { "id": "fixture_middle_age_event", "ageBandId": "middle_age" },
    { "id": "fixture_older_adult_event", "ageBandId": "older_adult" }
  ],
  "npcs": [
    { "id": "parent_working_a", "role": "parent", "parentJobId": "job_service" },
    { "id": "parent_working_b", "role": "parent", "parentJobId": "job_technical" },
    { "id": "parent_professional_a", "role": "parent", "parentJobId": "job_professional" },
    { "id": "parent_professional_b", "role": "parent", "parentJobId": "job_professional" },
    { "id": "parent_business_a", "role": "parent", "parentJobId": "job_business" },
    { "id": "parent_business_b", "role": "parent", "parentJobId": "job_service" },
    { "id": "parent_single_a", "role": "parent", "parentJobId": "job_care" },
    { "id": "parent_low_a", "role": "parent", "parentJobId": "job_service" },
    { "id": "parent_low_b", "role": "parent", "parentJobId": "job_unemployed" }
  ],
  "relationshipStates": [
    { "id": "potential" }, { "id": "dating" }, { "id": "exclusive" },
    { "id": "cohabiting" }, { "id": "engaged" }, { "id": "married" }
  ],
  "relationshipTransitions": [
    { "id": "potential_to_dating", "from": "potential", "to": "dating" },
    { "id": "dating_to_exclusive", "from": "dating", "to": "exclusive" },
    { "id": "exclusive_to_cohabiting", "from": "exclusive", "to": "cohabiting" },
    { "id": "cohabiting_to_engaged", "from": "cohabiting", "to": "engaged" },
    { "id": "engaged_to_married", "from": "engaged", "to": "married" }
  ],
  "metrics": [{ "id": "health" }, { "id": "relationship" }, { "id": "money" }],
  "endings": [{ "id": "fixture_balanced_life", "metricIds": ["health", "relationship", "money"] }],
  "simulationReport": {
    "schemaVersion": 1,
    "status": "not_run",
    "requestedLifeCount": 10000,
    "executedLifeCount": 0,
    "ageBandEventCoverage": {},
    "relationshipPathDistribution": {},
    "endingDistribution": {}
  }
}
